{
  "version": 1,
  "weights": { "verb": 0.35, "resource": 0.6, "stem": 0.8 },
  "queryStopwords": [
    "i", "me", "my", "mine", "we", "our", "us", "want", "wanna", "need", "please", "would", "like",
    "tell", "give", "help", "let", "know", "some", "something", "able", "try", "trying", "gonna"
  ],
  "verbs": [
    ["remove", "delete", "destroy", "drop", "erase", "trash", "discard", "purge"],
    ["get", "fetch", "retrieve", "read", "obtain", "load"],
    ["show", "view", "display", "read", "describe", "inspect"],
    ["list", "show", "enumerate", "display"],
    ["find", "search", "query", "lookup", "look up", "locate", "discover"],
    ["create", "add", "make", "new", "generate", "build", "insert", "open"],
    ["update", "edit", "modify", "change", "patch", "amend", "alter", "revise"],
    ["write", "save", "store", "put", "persist"],
    ["send", "post", "publish", "deliver", "dispatch"],
    ["run", "execute", "exec", "invoke", "launch", "evaluate", "eval"],
    ["trigger", "start", "launch", "fire", "kick off", "dispatch"],
    ["move", "relocate", "rename", "transfer"],
    ["duplicate", "copy", "clone"],
    ["restore", "undelete", "recover", "revive"],
    ["cancel", "abort", "revoke", "terminate"],
    ["stop", "halt", "terminate", "kill"],
    ["click", "tap", "press"],
    ["fill", "type", "enter", "input"],
    ["navigate", "open", "visit", "goto", "go to", "browse"],
    ["upload", "attach"],
    ["download", "export"],
    ["resolve", "close", "solve"],
    ["reply", "respond", "answer"],
    ["enable", "activate"],
    ["disable", "deactivate"],
    ["watch", "monitor", "observe", "track"],
    ["wait", "pause", "delay"],
    ["select", "choose", "pick"],
    ["extract", "scrape", "parse"],
    ["crawl", "spider", "traverse"],
    ["schedule", "book"],
    ["capture", "snap", "grab"],
    ["share", "grant", "invite"],
    ["review", "approve", "audit"]
  ],
  "resources": [
    ["issue", "ticket", "bug"],
    ["pr", "pull request", "merge request"],
    ["repo", "repository"],
    ["doc", "document", "documentation"],
    ["page", "document"],
    ["folder", "directory", "dir"],
    ["email", "mail", "inbox", "mailbox"],
    ["image", "picture", "photo", "screenshot"],
    ["message", "msg"],
    ["channel", "room"],
    ["thread", "conversation", "discussion"],
    ["user", "person", "people", "member", "account"],
    ["collaborator", "contributor", "member"],
    ["me", "self", "whoami", "who am i", "myself"],
    ["sprint", "cycle", "iteration"],
    ["label", "tag"],
    ["status", "state"],
    ["workflow", "pipeline"],
    ["db", "database"],
    ["sql", "query", "statement"],
    ["row", "record", "entry"],
    ["screenshot", "screen capture", "screengrab"],
    ["url", "link", "uri"],
    ["website", "site", "webpage"],
    ["event", "appointment", "meeting"],
    ["library", "lib", "package", "sdk"],
    ["setting", "config", "configuration", "preference"],
    ["permission", "access", "role"],
    ["team", "group"],
    ["org", "organization"],
    ["notification", "alert"],
    ["javascript", "js"],
    ["log", "trace"]
  ],
  "suffixes": [
    { "suffix": "ing", "append": ["", "e"], "undouble": true },
    { "suffix": "ed", "append": ["", "e"], "undouble": true },
    { "suffix": "ied", "append": ["y"] },
    { "suffix": "ation", "append": ["ate", "e", ""] },
    { "suffix": "ion", "append": ["e", ""] },
    { "suffix": "er", "append": ["", "e"], "undouble": true },
    { "suffix": "or", "append": ["", "e"] }
  ]
}
